Stt,Họ và tên, Giới tính, Ngày sinh(dd/mm/yyyy), Địa chỉ
1,Lê Tuyết, Nữ, 20/10/2006, Hoài Ân-Bình Định
1,Đỗ Hùng Sơn, Nam, 23/02/2006, Hoài Ân-Bình Định
1,Nguyễn Chí Khiêm, Nam, 10/10/2006, Hoài Ân-Bình Định
1,Nguyễn Tường Minh, Nam, 10/10/2006, Hoài Ân-Bình Định
1,Phạm Huyen, Nữ, 14/03/2006, Hoài Ân-Bình Định
1,Lê Bích Khuê, Nữ, 20/10/2006, Hoài Ân-Bình Định
1,Trần Vĩnh Ân, Nam, 10/10/2006, Hoài Ân-Bình Định
1,Trần Minh Khánh, Nam, 10/10/2006, Hoài Ân-Bình Định
1,Nguyễn Hồ Nam, Nam, 10/10/2006, Hoài Ân-Bình Định
1,Đỗ Mạnh Dũng, Nam, 23/02/2006, Hoài Ân-Bình Định
1,Nguyễn Duy Minh, Nam, 23/02/2006, Hoài Ân-Bình Định
1,Lê Nhã Hương, Nữ, 20/10/2006, Hoài Ân-Bình Định
1,Nguyễn Vương Triều, Nam, 23/02/2006, Hoài Ân-Bình Định
1,Phạm Mỹ Anh, Nữ, 14/03/2006, Hoài Ân-Bình Định
1,Lê Thùy My, Nữ, 20/10/2006, Hoài Ân-Bình Định
1,Nguyễn Bảo Thanh, Nữ, 14/03/2006, Hoài Ân-Bình Định
1,Nguyễn Thái Sang, Nam, 23/02/2006, Hoài Ân-Bình Định
1,Nguyễn Công Hậu, Nam, 10/10/2006, Hoài Ân-Bình Định
1,Nguyễn Tôn Lễ, Nam, 10/10/2006, Hoài Ân-Bình Định
1,Nguyễn Tuyết, Nữ, 14/03/2006, Hoài Ân-Bình Định
1,Lê Thúy An, Nữ, 20/10/2006, Hoài Ân-Bình Định
1,Lê Nhã Phương, Nữ, 20/10/2006, Hoài Ân-Bình Định
1,Bùi Khắc Thành, Nam, 23/02/2006, Hoài Ân-Bình Định
1,Nguyễn Tiến Hoạt, Nam, 10/10/2006, Hoài Ân-Bình Định
1,Nguyễn Phước An, Nam, 10/10/2006, Hoài Ân-Bình Định
1,Nguyễn Diệu Linh, Nữ, 20/10/2006, Hoài Ân-Bình Định
1,Trần Hữu Cường, Nam, 10/10/2006, Hoài Ân-Bình Định
1,Trần Mạnh Cường, Nam, 10/10/2006, Hoài Ân-Bình Định
1,Lê Thiên Bình, Nữ, 20/10/2006, Hoài Ân-Bình Định
1,Nguyễn Vân Nhi, Nữ, 14/03/2006, Hoài Ân-Bình Định
1,Nguyễn Mai Ngọc Lan, Nữ, 20/10/2006, Hoài Ân-Bình Định
1,Nguyễn Mạnh Quỳnh, Nam, 10/10/2006, Hoài Ân-Bình Định
1,Trần Nguyên Khôi, Nam, 10/10/2006, Hoài Ân-Bình Định